Wrong|Correct;;
Things get more serious when I become a member of the Amsterdam city council two year later . '|Things got more serious when I became a member of the Amsterdam city council two years later.';;
Schimmelpennink seize this opportunity to present a more elaborate Witte Fietsenplan to the city council .|Schimmelpennink seized this opportunity to present a more elaborate Witte Fietsenplan to the city council.;;
'My idea be that the municipality of Amsterdam would distribute 10,000 white bike over the city , for everyone to use , ' he explains .|'My idea was that the municipality of Amsterdam would distribute 10,000 white bikes over the city, for everyone to use,' he explains.;;
' I make serious calculation .|'I made serious calculations.;;
It turn out that a white bicycle - per person , per kilometre - would cost the municipality only 10 % of what it contribute to public transport per person per kilometre . '|It turned out that a white bicycle - per person, per kilometre - would cost the municipality only 10% of what it contributed to public transport per person per kilometre.';;
Nevertheless , the council unanimously reject the plan .|Nevertheless, the council unanimously rejected the plan.;;
they say that the bicycle belongs to the past .|'they said that the bicycle belongs to the past.;;
They saw a glorious future for the car , 'say Schimmelpennink .|They saw a glorious future for the car,'says Schimmelpennink.;;
But he be not in the least discourage .|But he was not in the least discouraged.;;
Schimmelpennink never stop believe in bike-sharing , and in the mid-90s , two Danes ask for his help to set up a system in Copenhagen .|Schimmelpennink never stopped believing in bike-sharing, and in the mid-90s, two Danes asked for his help to set up a system in Copenhagen.;;
The result be the world's first large-scale bike-share programme .|The result was the world's first large-scale bike-share programme.;;
It work on a deposit : 'You drop a coin in the bike and when you return it , you get your money back . '|It worked on a deposit: 'You dropped a coin in the bike and when you returned it, you got your money back.';;
After set up the Danish system , Schimmelpennink decide to try his luck again in the Netherlands - and this time he succeed in arouse the interest of the Dutch Ministry of Transport .|After setting up the Danish system, Schimmelpennink decided to try his luck again in the Netherlands - and this time he succeeded in arousing the interest of the Dutch Ministry of Transport.;;
times have change , ' he recall .|'times had changed,' he recalls.;;
'People have become more environmentally conscious , and the Danish experiment have prove that bike-sharing be a real possibility . '|'People had become more environmentally conscious, and the Danish experiment had proved that bike-sharing was a real possibility.';;
A new Witte Fietsenplan be launch in 1999 in Amsterdam .|A new Witte Fietsenplan was launched in 1999 in Amsterdam.;;
However , rid a white bike be no longer free ; it cost one guilder per trip and payment be make with a chip card developed by the Dutch bank Postbank .|However, riding a white bike was no longer free; it cost one guilder per trip and payment was made with a chip card developed by the Dutch bank Postbank.
Schimmelpennink design conspicuous , sturdy white bike lock in special rack which could be open with the chip card- the plan start with 250 bike , distribute over five station .|Schimmelpennink designed conspicuous, sturdy white bikes locked in special racks which could be opened with the chip card- the plan started with 250 bikes, distributed over five stations.;;
Theo Molenaar , who be a system designer for the project , work alongside Schimmelpennink .|Theo Molenaar, who was a system designer for the project, worked alongside Schimmelpennink.;;
' I remember when we be test the bike rack , he announce that he have already design well one .|'I remember when we were testing the bike racks, he announced that he had already designed better ones.;;
But of course , we have to go through with the one we have . '|But of course, we had to go through with the ones we had.';;
The system , however , be prone to vandalism and theft .|The system, however, was prone to vandalism and theft.;;
'After every weekend there would always be a couple of bike miss , ' Molenaar say .|'After every weekend there would always be a couple of bikes missing,' Molenaar says.;;
' I really have no idea what people do with them , because they could instantly be recognise a white bike . '|'I really have no idea what people did with them, because they could instantly be recognised as white bikes.';;
But the big blow come when Postbank decide to abolish the chip card , because it be n't profitable .|But the biggest blow came when Postbank decided to abolish the chip card, because it wasn't profitable.;;
that chip card be pivotal to the system , ' Molenaar say .|'that chip card was pivotal to the system,' Molenaar says.;;
to continue the project we would have need to set up another system , but the business partner have lose interest . '|'to continue the project we would have needed to set up another system, but the business partner had lost interest.';;
Schimmelpennink be disappointed , but- characteristically- not for long .|Schimmelpennink was disappointed, but- characteristically- not for long.;;
In 2002 he get a call from the French advertising corporation JC Decaux , who want to set up his bike-sharing scheme in Vienna .|In 2002 he got a call from the French advertising corporation JC Decaux, who wanted to set up his bike-sharing scheme in Vienna.;;
that go really well .|'that went really well.;;
After Vienna , they set up a system in Lyon .|After Vienna, they set up a system in Lyon.;;
Then in 2007 , Paris follow .|Then in 2007, Paris followed.;;
That be a decisive moment in the history of bike-sharing . '|That was a decisive moment in the history of bike-sharing.';;
The huge and unexpected success of the Parisian bike-sharing programme , which now boast more than 20,000 bicycle , inspire city all over the world to set up their own scheme , all model on Schimmelpennink's .|The huge and unexpected success of the Parisian bike-sharing programme, which now boasts more than 20,000 bicycles, inspired cities all over the world to set up their own schemes, all modelled on Schimmelpennink's.;;
It's wonderful that this happen , ' he say .|'It's wonderful that this happened,' he says.;;
But financially I do n't really benefit from it , because I never file for a patent . '|'But financially I didn't really benefit from it, because I never filed for a patent.';;
In Amsterdam today , 38 % of all trip be make by bike and , along with Copenhagen , it be regard a one of the two most cycle-friendly capital in the world - but the city never get another Witte Fietsenplan .|In Amsterdam today, 38% of all trips are made by bike and, along with Copenhagen, it is regarded as one of the two most cycle-friendly capitals in the world - but the city never got another Witte Fietsenplan.;;
Molenaar believe this may be because everybody in Amsterdam already have a bike .|Molenaar believes this may be because everybody in Amsterdam already has a bike.;;
Schimmelpennink , however , can not see that this change Amsterdam's need for a bike-sharing scheme .|Schimmelpennink, however, cannot see that this changes Amsterdam's need for a bike-sharing scheme.;;
People who travel on the underground do n't carry their bike around .|'People who travel on the underground don't carry their bikes around.;;
But often they need additional transport to reach their final destination . '|But often they need additional transport to reach their final destination.';;
Although he think it be strange that a city like Amsterdam do not have a successful bike­ share scheme , he be optimistic about the future .|Although he thinks it is strange that a city like Amsterdam does not have a successful bike­ sharing scheme, he is optimistic about the future.;;
In the '60s we do n't stand a chance because people be prepared to give their life to keep car in the city .|'In the '60s we didn't stand a chance because people were prepared to give their lives to keep cars in the city.;;
But that mentality have totally change .|But that mentality has totally changed.;;
Today everybody longs for city that be not dominate by car . '|Today everybody longs for cities that are not dominated by cars.';;
They play hard , they play often , and they play to win .|They play hard, they play often, and they play to win.;;
Australian sport team win more than their fair share of title , demolish rival with seem ease .|Australian sports teams win more than their fair share of titles, demolishing rivals with seeming ease.;;
How do they do it ?|How do they do it?;;
A big part of the secret be an extensive and expensive network of sport academy underpinned by science and medicine .|A big part of the secret is an extensive and expensive network of sporting academies underpinned by science and medicine.;;
At the Australian Institute of Sport ( AIS ) , hundred of young and pro live and train under the eye of coach .|At the Australian Institute  of Sport (AIS), hundreds of youngest and pros live and train under the eyes of coaches.;;
Another body , the Australian Sports Commission ( ASC ) , finance programme of excellence in a total of 96 sport for thousand of sportsman and woman .|Another body, the Australian Sports Commission (ASC), finances programmes of excellence in a total of  96 sports for thousands of sportsmen and women.;;
Both provide intensive coach , training facility and nutritional advice .|Both provide intensive coaching, training facilities and nutritional advice.;;
Inside the academy , science take centre stage .|Inside the academies, science takes centre stage.;;
The AIS employ more than 100 sport scientist and doctor , and collaborates with score of others in university and research centre .|The AIS employs more than 100 sports scientists and doctors, and collaborates with scores of others in universities and research centres.;;
AIS scientist work across a number of sport , apply skill learn in one - such a building muscle strength in golfer – to others , such a swim and squash .|AIS scientists work across a number of sports, applying skills learned in one - such as building muscle strength in golfers – to others, such as swimming and squash.;;
They be back up by technician who design instrument s to collect data from athlete .|They are backed up by technicians who designs instrument s to collect data from athletes.;;
They all focus on one aim : win .|They all focus on one aim: winning.;;
‘ We can ’ t waste our time look at ethereal scientific question that don ’ t help the coach work with an athlete and improve performance , 'say Peter Fricker , chief of science at AIS .|‘We can’t waste our time looking at ethereal scientific questions that don’t help the coach work with an athlete and improve performance,'says Peter Fricker, chief of science at AIS.;;
A lot of their work come down to measurement - everything from the exact angle of a swimmer 's dive to the second-by-second power output of a cyclist .|A lot of their work comes down to measurement -  everything from the exact angle of a swimmer’s dive to the second-by-second power output of a cyclist.;;
This data be use to wring improvement out of athlete .|This data is used to wring improvements out of athletes.;;
The focus be on individual , tweak performance to squeeze an extra hundredth of a second here , an extra millimetre there .|The focus is on individuals, tweaking performances to squeeze an extra hundredth of  a second here, an extra millimetres there.;;
No gain be too slight to bother It 's the tiny , gradual improvement that add up to world-beating result .|No gain is too slight  to bother  It’s the tiny, gradual improvements that add up to world-beating results.;;
To demonstrate how the system work , Bruce Mason at AIS show off the prototype of 3D analysis tool for study swimmer .|To demonstrate how the system works, Bruce Mason at AIS shows off  the prototype of 3D analysis tool for studying swimmers.;;
A wire-frame model of a champion swimmer slice through the water , her arm move in slow motion .|A wire-frame model of a champion swimmer slices through the water, her arms moving in slow motion.;;
Looking side-on , Mason measure the distance between stroke .|Looking side-on, Mason measures the distance between strokes.;;
From above , he analysis how her spine swivel .|From above, he analyses how her spine swivels.;;
When fully developed , this system will enable him to build a biomechanical profile for coach to use to help budding swimmer .|When fully developed, this system will enable him to build a biomechanical profile for coaches to use to help budding swimmers.;;
Mason 's contribution to sport also include the development of the SWAN ( Swimming Analysis ) system now use in Australian national competition .|Mason’s contribution to sport also includes the development of the SWAN (Swimming Analysis) system now used in Australian national competitions.;;
It collect image from digital camera run at 50 frame a second and break down each part of a swimmer 's performance into factor that can be analyse individually – stroke length , stroke frequency , average duration of each stroke , velocity , start , lap and finish time , and so on .|It collects images from digital cameras running at 50 frames a second and breaks down each part of a swimmer’s performance into factors that can be analysed individually – stroke length, stroke frequency, average duration of each stroke, velocity, start, lap and finish times, and so on.;;
At the end of each race , SWAN spit out data on each swimmer .|At the end of each race, SWAN spits out data on each swimmer.;;
‘ Take a look ’ , say Mason , pull out a sheet of data .|‘Take a look’, says Mason, pulling out a sheet of data.;;
He point out the data on the swimmer in second and third place , which show that the one who finish third actually swam faster .|He point out the data on the swimmers in second and third place, which shows that the one who finished third actually swam faster.;;
So why do he finish 35 hundredth of a second down ?|So why did he finish 35 hundredths of a second down?;;
‘ His turn time be 44 hundredth of a second behind the other guy , 'say Mason .|‘His turn times were 44 hundredths of a second behind the other guy,'says Mason.;;
‘ If he can improve on his turn , he can do much well ’ .|‘If he can improve on his turns, he can do much better’.;;
This be the kind of accuracy that AIS scientist ’ research be bring to a range of sport .|This is the kind of accuracy that AIS scientists’ research is bringing to a range of sports.;;
With the Cooperative Research Centre for Micro Technology in Melbourne , they be develop unobtrusive sensor that will be embed in an athlete 's clothes or run shoe to monitor heart rate , sweat , heat production or any other factor that might have an impact on an athlete 's ability to run .|With the Cooperative Research Centre for Micro Technology in Melbourne, they are developing unobtrusive sensors that will be embedded in an athlete’s clothes or running shoes to monitor heart rate, sweating, heat production or any other factor that might have an impact on an athlete’s ability to run.;;
There 's more to it than simply measure performance .|There’s more to it than simply measuring performance.;;
Fricker give the example of athlete who may be down with cough and cold 11 or 12 time a year .|Fricker gives the example of athletes who may be down with coughs and colds 11 or 12 times a year.;;
After year of experimentation , AIS and the University of Newcastle in New South Wales developed a test that measure how much of the immune-system protein immunoglobulin A be present in athlete 'saliva .|After years of experimentation, AIS and the University of Newcastle in New South Wales developed a test that measures how much of the immune-system protein immunoglobulin A is present in athletes'saliva.;;
If lgA level suddenly fall below a certain level , training be ease or drop altogether .|If lgA levels suddenly fall below a certain level, training is eased or dropped altogether.;;
Soon , lgA level start rise again , and the danger pas .|Soon, lgA levels start rising again, and the danger passes.;;
Since the test be introduce , AIS athlete in all sport have be remarkably successful at stay healthy .|Since the test were introduced, AIS  athletes in all sports have been remarkably successful at staying healthy.;;
Using data be a complex business .|Using data is a complex business.;;
Well before a championship , sport scientist and coach start prepare the athlete by develop a ‘ competition model ’ , base on what they expect will be the win time .|Well before a championship, sports scientists and coaches start prepare the athlete by developing a ‘competition model’, based on what they expect will be the winning times.;;
‘ You design the model to make that time ’ , say Mason .|‘You design the model to make that time’, says Mason.;;
‘ A start of this much , each tree-swimming period have to be this fast , with a certain stroke frequency and stroke length , with turn do in these time ’ .|‘A start of this much, each tree-swimming period has to be this fast, with a certain stroke frequency and stroke length, with turn done in these times’.;;
All the training be then gear towards make the athlete hit those target , both overall and for each segment of the race .|All the training is then geared towards making the athlete hit those targets, both overall and for each segment of the race.;;
Techniques like these have transform Australia into arguably the world 's most successful sport nation .|Techniques like these have transformed Australia into arguably the world’s most successful sporting nation.;;
Of course , there 's nothing to stop other country copying – and many have try .|Of course, there’s nothing to stop other countries copying – and many have tried.;;
Some year ago , the AIS unveiled coolant-lined jacket for endurance athlete .|Some years ago, the AIS unveiled coolant-lined jackets for endurance athletes.;;
At the Atlanta Olympic Games in 1996 , these slice a much a two per cent off cyclist ‘ and rower ’ time .|At the Atlanta Olympic Games in 1996, these sliced as much as two per cent off cyclists ‘and rowers’ times.;;
Now everyone u them .|Now everyone uses them.;;
The same have happen to the ‘ altitude tent ’ , developed by AIS to replicate the effect of altitude training at sea level .|The same has happened to the ‘altitude tent’, developed by AIS to replicate the effect of altitude training at sea level.;;
But Australia 's success story be about more than easily copy technological fix , and up to now no nation have replicate it all-encompassing system .|But Australia’s success story is about more than easily copied technological fixes, and up to now no nation has replicated its all-encompassing system.;;
International trade be grow at a start pace .|International trade is growing at a starting pace.;;
While the global economy have be expand at a bit over 3 % a year , the volume of trade have be rise at a compound annual rate of about twice that .|While the global economy has been expanding at a bit over 3% a year, the volume of trade has been rising at a compound annual rate of about twice that.;;
Foreign product , from meat to machinery , play a more important role in almost every economy in the world , and foreign market now tempt business that never much worried about sale beyond their nation 's border .|Foreign products, from meat to machinery, play a more important role in almost every economy in the world, and foreign markets now tempt businesses that never much worried about sales beyond their nation’s borders.;;
What lie behind this explosion in international commerce ?|What lies behind this explosion in international commerce?;;
The general worldwide decline in trade barrier , such a custom duty and import quota , be surely one explanation .|The general worldwide decline in trade barriers, such as customs duties and import quotas, is surely one explanation.;;
The economic opening of country that have traditionally be minor player be another .|The economic opening of countries that have traditionally been minor players is another.;;
But one force behind the import-export boom have pas all but unnoticed : the rapidly fail cost of get good to market .|But one force behind the import-export boom has passed all but unnoticed: the rapidly failing cost of getting goods to market.;;
Theoretically , in the world of trade , shipping cost do not matter .|Theoretically, in the world of trade, shipping costs do not matter.;;
Goods , once they have be make , be assume to move instantly and at no cost from place to place .|Goods, once they have been made, are assumed to move instantly and at no cost from place to place.;;
The real world , however , be full of friction .|The real world, however, is full of frictions.;;
Cheap labour may make Chinese clothing competitive in America , but if delay in shipment tie up work capital and cause winter coat to arrive in spring , trade may lose it advantage .|Cheap labour may make Chinese clothing competitive in America, but if delays in shipment tie up working capital and cause winter coats  to arrive in spring, trade may lose its advantages.;;
At the turn of the 20th century , agriculture and manufacturing be the two most important sector almost everywhere , accounting for about 70 % of total output in Germany , Italy and France , and 40-50 % in American , Britain an Japan .|At the turn of the 20th century, agriculture and manufacturing were the two most important sectors almost everywhere, accounting for about 70% of total output in Germany, Italy and France, and 40-50% in American, Britain an Japan.;;
International commerce be therefore dominate by raw material , such a wheat , wood and iron ore , or process commodity , such a meat and steel .|International commerce was therefore dominated by raw materials, such as wheat, wood and iron ore, or processed commodities, such as meat and steel.;;
But these sort of product be heavy and bulky and the cost of transport them relatively high .|But these sorts of products are heavy and bulky and the cost of transporting them relatively high.;;
Countries still trade disproportionately with their geographic neighbor .|Countries still trade disproportionately with their geographic neighbors.;;
Overtime , however , world output have shift into good whose worth be unrelated to their size and weight .|Overtime, however, world output has shifted into goods whose worth is unrelated to their size and weight.;;
Today , it be finish manufacture product that dominate the flow of trade , and , thanks to technological advance such a lightweight component , manufacture good themselves have tend to become lighter and le bulky .|Today, it is finished manufactured products that dominate the flow of trade, and, thanks to technological advances such as lightweight components, manufactured goods themselves have tended to become lighter and less bulky.;;
As a result , le transportation be require for every dollar 's worth of import or export .|As a result, less transportation is required for every dollar’s worth of imports or exports.;;
To see how this influence trade , consider the business of make disk drive for computer .|To see how this influences trade, consider the business of making disk drives for computers.;;
Most of the world 's disk-drive manufacturing be concentrate in South-east Asia .|Most of the world’s disk-drive manufacturing is concentrated in South-east Asia.;;
This be possible only because disk drive , while valuable , be small and light and so cost little to ship .|This is possible only because disk drives, while valuable, are small and light and so cost little to ship.;;
Computer manufacture in Japan or Texas will not face hugely big freight bill if they import drive from Singapore rather than purchasing them on the domestic market .|Computer manufactures in Japan or Texas will not face hugely bigger freight bills if they import drives from Singapore rather than purchasing them on the domestic market.;;
Distance therefore posse no obstacle to the globalisation of the disk-drive industry .|Distance therefore posses no obstacle to the globalisation of the disk-drive industry.;;
This be even more true of the fast- grow information industry .|This is even more true of the fast- growing information industries.;;
Films and compact disc cost little to transport , even by aeroplane .|Films and compact discs cost little to transport, even by aeroplane.;;
Computer software can be ‘ export ’ without ever load it onto a ship , simply by transmit it over telephone line from one country to another , so freight rate and cargo-handling schedule become insignificant factor in decide where to make the product .|Computer software can be ‘exported’ without ever loading it onto a ship, simply by transmitting it over telephone lines from one country to another, so freight rates and cargo-handling schedules become insignificant factors in deciding where to make the product.;;
Businesses can locate base on other consideration , such a the availability of labour , while worry le about the cost of deliver their output .|Businesses can locate based on other considerations, such as the availability of labour, while worrying less about the cost of delivering their output.;;
