Wrong|Correct;;
But the same lust for life that fuel my too-young-to-be-lawyering year and my eating-all-of-the-soup year sustains me now .|But the same lust for life that fuelled my too-young-to-be-lawyering years and my eating-all-of-the-soup years sustains me now.;;
Life change in an instant , and I feel proud that I packed in more in my 40 year than many people get in a lifetime .|Life changes in an instant, and I feel proud that I packed in more in my 40 years than many people get in a lifetime.;;
For the last two year , I 've have to live life from the inside-out , search for answer that don ’ t exist .|For the last two years, I’ve had to live life from the inside-out, searching for answers that don’t exist.;;
Trying to keep my brain afloat both literally and figuratively .|Trying to keep my brain afloat both literally and figuratively.;;
To be clear , she chose the message not me .|To be clear, she chose the message not me.;;
But it be both hilarious and delicious , and I save some of it for future consumption .|But it was both hilarious and delicious, and I saved some of it for future consumption.;;
I go to bed content on my 40th .|I went to bed content on my 40th.;;
Even without the food I use to ob over , I felt sate .|Even without the foods I used to obsess over, I felt sated.;;
And most of all , I felt deeply care for .|And most of all, I felt deeply cared for.;;
Many of u have a hard time receive love , and that 's be a lesson for me in the past two year .|Many of us have a hard time receiving love, and that’s been a lesson for me in the past two years.;;
It 's hard not to feel unworthy – not of love generally , but the fierceness and care of so many who want to see me well .|It’s hard not to feel unworthy – not of love generally, but the fierceness and care of so many who want to see me well.;;
The natural awkwardness of that feel be far eclipse by the strength it give me , and the humble effect the support have .|The natural awkwardness of that feeling is far eclipsed by the strength it gives me, and the humbling effect the support has.;;
I 've always look young , something that be a liability a a lawyer and a source of mirth a a traveler .|I’ve always looked young, something that was a liability as a lawyer and a source of mirth as a traveler.;;
But now , it feel particularly off-key .|But now, it feels particularly off-key.;;
When I first arrive in New York a a summer associate I be 20 .|When I first arrived in New York as a summer associate I was 20.;;
Amazed I be there at all , I would scrutinize people 's face a they pas by .|Amazed I was there at all, I would scrutinize people’s faces as they passed by.;;
Who would I look like ?|Who would I look like?;;
Where would my life lead me in 20 year time ?|Where would my life lead me in 20 years time?;;
It 's always fascinate to remember the shape of those prediction in retrospect .|It’s always fascinating to remember the shape of those predictions in retrospect.;;
I look at my face and my face doesn ’ t look forty .|I look at my face and my face doesn’t look forty.;;
I look at my face and think , who care how old my face look ?|I look at my face and think, who cares how old my face looks?;;
In that 2011 Rumpus column , Strayed writes about the interstitial year between know your heart 's path and make it there , eventually .|In that 2011 Rumpus column, Strayed writes about the interstitial years between knowing your heart’s path and making it there, eventually.;;
Many of you have ask about way to support me at a time where I can ’ t physically work the way I use to .|Many of you have asked about ways to support me at a time where I can’t physically work the way I used to.;;
Patreon be a great way to do so .|Patreon is a great way to do so.;;
I release my Patreon to the world during the last week of February .|I released my Patreon to the world during the last week of February.;;
For those unfamiliar with Patreon , it 's a membership platform that allows people to sign up to receive update , behind the scene video , private podcasts and more from their favourite creatives , writer , or artist .|For those unfamiliar with Patreon, it’s a membership platform that allows people to sign up to receive updates, behind the scenes videos, private podcasts and more from their favourite creatives, writers, or artists.;;
A lot of you in this community have suggest I start one up , and in my tiny work increment I be able to get it up and run .|A lot of you in this community have suggested I start one up, and in my tiny working increments I was able to get it up and running.;;
Many of my travel blogging peer have start one , but my Patreon be a bit different than the norm , because it 's support only .|Many of my travel blogging peers have started one, but my Patreon is a bit different than the norm, because it’s support only.;;
So instead of each tier offering more and more reward for what you sign up for , my campaign have each tier receive the same access and benefit a the others .|So instead of each tier offering more and more rewards for what you sign up for, my campaign has each tier receiving the same access and benefits as the others.;;
But !|But!;;
Unlike many support-only Patreons , it still do have fun goody ( below ) , because there be still many fun thing I can provide within my limited state .|Unlike many support-only Patreons, it still does have fun goodies (below), because there are still many fun things I can provide within my limited state.;;
I structure it this way because pain limit my day to day output so much that I ’ d rather be absolutely sure that I can deliver what I promise , vs. create high monetary tier and break that promise .|I structured it this way because pain limits my day to day output so much that I’d rather be absolutely sure that I can deliver what I promise, vs. creating high monetary tiers and break that promise.;;
It 's an amaze feel to have a community of people ask to support me from far flung place .|It’s an amazing feeling to have a community of people asking to support me from far flung places.;;
I 've have artist and photographer reach out a well , to provide monthly goody that I can add to the tier — mostly bird-related or soup-related , which seem about right !|I’ve had artists and photographers reach out as well, to provide monthly goodies that I can add to the tiers — mostly bird-related or soup-related, which seems about right!;;
The launch video be below .|The launch video is below.;;
Patreon page be here .|Patreon page is here.;;
We 'reup to about 170 people now , at the time of write .|We’re up to about 170 people now, at the time of writing.;;
I be never one of those “ I ’ m go to write 4000 word every morning ” people .|I was never one of those “I’m going to write 4000 words every morning” people.;;
Unless I be under deadline , my write held the same kind of whimsy a my travel : when inspiration struck , I pounce .|Unless I was under deadline, my writing held the same kind of whimsy as my travels: when inspiration struck, I pounced.;;
And then I basically go feral .|And then I basically went feral.;;
When the tingly , “ I need to write ” feel start , I knew I need to stock up on snack , get a shower in now , and cancel plan with friend .|When the tingly, “I need to write” feeling started, I knew I needed to stock up on snacks, get a shower in now, and cancel plans with friends.;;
I would forget to eat , live , and do day-to-day task ; write blot everything out .|I would forget to eat, live, and do day-to-day tasks; writing blotted everything out.
It sound manic , I ’ ll give you that , but it work for me because I never knew where the write journey would lead me .|It sounds manic, I’ll give you that, but it worked for me because I never knew where the writing journey would lead me.;;
I never have a set arc before I sat down to my laptop but found the joy partly in the process of my brain 's wander .|I never had a set arc before I sat down to my laptop but found the joy partly in the process of my brain’s wandering.;;
( Case in point : I stood up to write this post now , and realize I miss something I be suppose to do at 8pm… because I get lose in write . )|(Case in point: I stood up to write this post now, and realized I missed something I was supposed to do at 8pm… because I got lost in writing.);;
My point be here be that the act of write be itself such a big part of what make me feel creative and alive , and it 's be very hard not to have it in my life .|My point is here is that the act of writing is itself such a big part of what makes me feel creative and alive, and it’s been very hard not to have it in my life.;;
I 've realize voice-to-text do not bring me the need tinglies , nor do other accommodation for my CSF leak .|I’ve realized voice-to-text does not bring me the needed tinglies, nor do other accommodations for my CSF leak.;;
So a I say in my 12 year of Legal Nomads post , I ’ m go to be move toward a podcast instead .|So as I said in my 12 years of Legal Nomads post, I’m going to be moving toward a podcast instead.;;
The podcast be go to be call Ask a Jodi , but I 've change the name to be “ The Way Through ” – because at it core , it be a podcast about get through the ups and down of life .|The podcast was going to be called Ask a Jodi, but I’ve changed the name to be “The Way Through” – because at its core, it is a podcast about getting through the ups and downs of life.;;
If you have topic you ’ d like me to cover , I ’ d love to hear from you !|If you have topics you’d like me to cover, I’d love to hear from you!;;
Email me at jodi- @ -legalnomads .com or via my contact page .|Email me at jodi-@-legalnomads .com or via my contact page.;;
Thus far , I have a list I 've kept from your question , which include how to be more resilient , how to be le anxious , and how to sleep well .|Thus far, I have a list I’ve kept from your questions, which includes how to be more resilient, how to be less anxious, and how to sleep better.;;
That 's it for now !|That’s it for now!;;
Thanks for all your support , love , and enthusiasm a I navigate through this complicate time .|Thanks for all your support, love, and enthusiasm as I navigate through this complicated time.;;
I hope you 'restay safe and well .|I hope you’re staying safe and well.;;Many Americans are keen to explore the world again after a year of travel restrictions.|Many Americans are keen to explore the world again after a year of travel restrictions.
But a surge in demand has led to a delay in passport processing times, with some centers experiencing a turnaround time of up to 18 weeks.|But a surge in demand has led to a delay in passport processing times, with some centers experiencing a turnaround time of up to 18 weeks.
If you plan to travel soon, here's what you need to know about renewing or applying for a passport in time for your trip.|If you plan to travel soon, here's what you need to know about renewing or applying for a passport in time for your trip.
The department of state travel is advising travelers to allow up to 18 weeks to receive their passport documents and is urging the public to plan ahead and apply well before any scheduled travel.|The Department of State Travel is advising travelers to allow up to 18 weeks to receive their passport documents and is urging the public to plan ahead and apply well before any scheduled travel.
Some centers are processing passports within a 12-week timeframe but other service providers, including the us postal service, have been experiencing operational issues which the department explains is resulting in delays in applications getting to passport agencies and centers.|Some centers are processing passports within a 12-week timeframe but other service providers, including the US postal service, have been experiencing operational issues which the Department explains is resulting in delays in applications getting to passport agencies and centers.
"Due to these delays, routine service can take up to 18 weeks from the day a customer submits their application to the day they receive a new passport," a department spokesperson told lonely planet.|"Due to these delays, routine service can take up to 18 weeks from the day a customer submits their application to the day they receive a new passport," a Department spokesperson told Lonely Planet.
"The 18-week timeframe includes up to 12 weeks for processing and up to six weeks for mailing times."|"The 18-week timeframe includes up to 12 weeks for processing and up to six weeks for mailing times."
When applying for a new passport, it's important to note that the processing times listed on the website begin the day they receive your application, not the day you mail it.|When applying for a new passport, it's important to note that the processing times listed on the website begin the day they receive your application, not the day you mail it.
Generally, customers applying for routine service domestically can expect to receive a passport within 12 weeks from the date of application, or within six weeks from the date the application is received if they pay an additional $60 fee to expedite their passport.|Generally, customers applying for routine service domestically can expect to receive a passport within 12 weeks from the date of application, or within six weeks from the date the application is received if they pay an additional $60 fee to expedite their passport.
You can apply for a new passport through the post office, clerks of court, and public libraries but the department is encouraging applicants to renew their passports by mail when possible as a "safe, contactless option".|You can apply for a new passport through the post office, clerks of court, and public libraries but the Department is encouraging applicants to renew their passports by mail when possible as a "safe, contactless option".
In exceptional circumstances, such as cases of life-or-death emergencies and essential travel, passports can potentially be renewed within 72 hours.|In exceptional circumstances, such as cases of life-or-death emergencies and essential travel, passports can potentially be renewed within 72 hours.
However, customers must request an appointment through the department of state travel website and present proof of travel within the next three days.|However, customers must request an appointment through the Department of State Travel website and present proof of travel within the next three days.
Speaking about the reasons for delays, the department spokesperson explained "we always see an upsurge during the summer travel season.|Speaking about the reasons for delays, the Department spokesperson explained "we always see an upsurge during the summer travel season.
While this year isn’t as large as previous seasons because of the pandemic, we are still under covid-19-related staffing restrictions.|While this year isn’t as large as previous seasons because of the pandemic, we are still under COVID-19-related staffing restrictions.
We urge people not to wait to apply for a passport and apply at least six months ahead of planned travel when possible."|We urge people not to wait to apply for a passport and apply at least six months ahead of planned travel when possible."
The department is also encouraging applicants to do their research before applying for a passport through "passport expeditors" courier companies.|The Department is also encouraging applicants to do their research before applying for a passport through "passport expeditors" courier companies.
"Be wary - they charge additional fees, and you will not receive your passport any faster than you would if you applied in person at a passport agency," the spokesperson warned.|"Be wary - they charge additional fees, and you will not receive your passport any faster than you would if you applied in person at a Passport Agency," the spokesperson warned.
"You are still required to appear in person at an acceptance facility if applying on form ds-11 (first-time application), even when using a courier service."|"You are still required to appear in person at an acceptance facility if applying on Form DS-11 (first-time application), even when using a courier service."
Those who have only received one vaccination dose can still visit finland but they're required to take a COVID-19 test within 72 hours of departure.|Those who have only received one vaccination dose can still visit Finland but they're required to take a COVID-19 test within 72 hours of departure.
Unvaccinated tourists can also visit but they'll need to take a test before departure and a test upon arrival.|Unvaccinated tourists can also visit but they'll need to take a test before departure and a test upon arrival.
Those who can prove they have had covid-19 within the last six months and have recovered from the virus are permitted to enter without testing.|Those who can prove they have had COVID-19 within the last six months and have recovered from the virus are permitted to enter without testing.
The new measures will be reviewed every fortnight and apply to people traveling from eu and schengen countries, as well as those coming from destinations outside these zones that are classified as low-risk(where the incidence of covid-19 is low).|The new measures will be reviewed every fortnight and apply to people traveling from EU and Schengen countries, as well as those coming from destinations outside these zones that are classified as low-risk(where the incidence of COVID-19 is low).
This includes australia, hong kong, israel, china, malta, poland, new zealand and singapore among others.|This includes Australia, Hong Kong, Israel, China, Malta, Poland, New Zealand and Singapore among others.
Any other travelers must be tested for covid-19 as soon as they arrive in finland, self-isolate and take a second test between three and five days after arrival.|Any other travelers must be tested for COVID-19 as soon as they arrive in Finland, self-isolate and take a second test between three and five days after arrival.
This includes arrivals from the us and uk.|This includes arrivals from the US and UK.
The Finnish government announced on tuesday it was relaxing travel restrictions after more than a year of tight border and domestic controls to curb the spread of covid-19.|The Finnish government announced on Tuesday it was relaxing travel restrictions after more than a year of tight border and domestic controls to curb the spread of COVID-19.
Across the "world's happiest country", hotels and attractions are open and restaurants, cafes and bars are open for indoor and outdoor service.|Across the "world's happiest country", hotels and attractions are open and restaurants, cafes and bars are open for indoor and outdoor service.
Generally they can stay open until midnight but opening times can vary by region with local restrictions.|Generally they can stay open until midnight but opening times can vary by region with local restrictions.
Infections are rising in finland in recent weeks, but Reuters reports that it remains among the countries least affected by covid-19.|Infections are rising in Finland in recent weeks, but Reuters reports that it remains among the countries least affected by COVID-19.
According to the Finnish health ministry, 60% of eligible adults have received their first dose of a vaccine and 21.4% have received their second dose.|According to the Finnish health ministry, 60% of eligible adults have received their first dose of a vaccine and 21.4% have received their second dose.
amun-ra was the local god of karnak (luxor) and during the new kingdom, when the princes of thebes ruled egypt, he became the preeminent state god, with a temple that reflected his status.|Amun-Ra was the local god of Karnak (Luxor) and during the New Kingdom, when the princes of Thebes ruled Egypt, he became the preeminent state god, with a temple that reflected his status.
At the height of its power, the temple owned 421,000 head of cattle, 65 cities, 83 ships and 276,400 hectares of agricultural land and had 81,000 people working for it.|At the height of its power, the temple owned 421,000 head of cattle, 65 cities, 83 ships and 276,400 hectares of agricultural land and had 81,000 people working for it.
The shell that remains, sacked by Assyrians and Persians, is still one of the world's great archaeological sites, grand, beautiful and inspiring.|The shell that remains, sacked by Assyrians and Persians, is still one of the world's great archaeological sites, grand, beautiful and inspiring.
The quay of amun was the dock where the large boats carrying the statues of the gods moored during festivals.|The Quay of Amun was the dock where the large boats carrying the statues of the gods moored during festivals.
From paintings in the tomb of nakht and elsewhere we know that there were palaces to the north of the quay and that these were surrounded by lush gardens.|From paintings in the tomb of Nakht and elsewhere we know that there were palaces to the north of the quay and that these were surrounded by lush gardens.
On the east side, a ramp slopes down to the processional avenue of ram-headed sphinxes.|On the east side, a ramp slopes down to the processional avenue of ram-headed sphinxes.
These lead to the massive unfinished first pylon, the last to be built, during the reign of nectanebo I (30th dynasty).|These lead to the massive unfinished first pylon, the last to be built, during the reign of Nectanebo I (30th dynasty).
The inner side of the pylon still has the massive mud-brick construction ramp, up which blocks of stone for the pylon were dragged with rollers and ropes.|The inner side of the pylon still has the massive mud-brick construction ramp, up which blocks of stone for the pylon were dragged with rollers and ropes.
napoleon’s expedition recorded blocks still on the ramp.|Napoleon’s expedition recorded blocks still on the ramp.
Behind the first pylon lies the great court, the largest area of the karnak complex.|Behind the first pylon lies the Great Court, the largest area of the Karnak complex.
To the left is the shrine of seti ii, with three small chapels that held the sacred barques (boats) of mut, amun and khonsu during the lead-up to the opet festival.|To the left is the Shrine of Seti II, with three small chapels that held the sacred barques (boats) of Mut, Amun and Khonsu during the lead-up to the Opet Festival.
In the southeastern corner (far right) is the well-preserved temple of ramses iii, a miniature version of the pharaoh’s temple at medinat habu.|In the southeastern corner (far right) is the well-preserved Temple of Ramses III, a miniature version of the pharaoh’s temple at Medinat Habu.
The temple plan is simple and classic: pylon, open court, vestibule with four osirid columns and four columns, hypostyle hall with eight columns and three barque chapels for amun, mut and khonsu.|The temple plan is simple and classic: pylon, open court, vestibule with four Osirid columns and four columns, hypostyle hall with eight columns and three barque chapels for Amun, Mut and Khonsu.
At the centre of the court is a 21m column with a papyrus-shaped capital – the only survivor of ten columns that originally stood here – and a small alabaster altar, all that remains of the kiosk of taharka, the 25th-dynasty Nubian pharaoh.|At the centre of the court is a 21m column with a papyrus-shaped capital – the only survivor of ten columns that originally stood here – and a small alabaster altar, all that remains of the Kiosk of Taharka, the 25th-dynasty Nubian pharaoh.
The second pylon was begun by horemheb, the last 18th-dynasty pharaoh, and continued by ramses I and ramses ii, who also raised three colossal red-granite statues of himself on either side of the entrance; one is now destroyed.|The second pylon was begun by Horemheb, the last 18th-dynasty pharaoh, and continued by Ramses I and Ramses II, who also raised three colossal red-granite statues of himself on either side of the entrance; one is now destroyed.
Beyond the second pylon is the extraordinary great hypostyle hall, one of the greatest religious monuments ever built.|Beyond the second pylon is the extraordinary Great Hypostyle Hall, one of the greatest religious monuments ever built.
Covering 5500 sq m – enough space to contain both rome’s st peter’s basilica and london’s st paul’s cathedral – the hall is an unforgettable forest of 134 towering stone pillars.|Covering 5500 sq m – enough space to contain both Rome’s St Peter’s Basilica and London’s St Paul’s Cathedral – the hall is an unforgettable forest of 134 towering stone pillars.
Their papyrus shape symbolise a swamp, of which there were so many along the nile.|Their papyrus shape symbolise a swamp, of which there were so many along the Nile.
Ancient Egyptians believed that these plants surrounded the primeval mound on which life was first created.|Ancient Egyptians believed that these plants surrounded the primeval mound on which life was first created.
Each summer when the nile began to flood, this hall and its columns would fill with several feet of water.|Each summer when the Nile began to flood, this hall and its columns would fill with several feet of water.
Originally, the columns would have been brightly painted – some colour remains – and roofed, making it pretty dark away from the lit main axis.|Originally, the columns would have been brightly painted – some colour remains – and roofed, making it pretty dark away from the lit main axis.
