In 1 845, however, Cooke and Wheatstone succeed in producing the single needle apparatus, which they patented,and from that time the electric telegraph became a practical instrument, soon adopted on all the railway lines of the country.|In 1 845, however, Cooke and Wheatstone succeeded in producing the single needle apparatus, which they patented,and from that time the electric telegraph became a practical instrument, soon adopted on all the railway lines of the country.
It was the European optical telegraph, or semaphore, that was the predecessor of the electrical recording telegraph that changed the history of communication forever.|It was the European optical telegraph, or semaphore, that was the predecessor of the electrical recording telegraph that changed the history of communication forever.
Building on the success of the optical telegraph, Samuel F. B. Morse complete a working version of the electrical recording telegraph, which only required a single wire to send code of dots and dashes.|Building on the success of the optical telegraph, Samuel F. B. Morse completed a working version of the electrical recording telegraph, which only required a single wire to send code of dots and dashes.
At first, it be imagined that only a few highly skilled encoders would be able to use it but it soon became clear that many people could become proficient in Morse code.|At first, it was imagined that only a few highly skilled encoders would be able to use it but it soon became clear that many people could become proficient in Morse code.
A system of lines strung on telegraph poles began to spread in Europe and America.|A system of lines strung on telegraph poles began to spread in Europe and America.
In the 1840s and 1850s several individuals proposed or advocated construction of a telegraph cable across the Atlantic Ocean, including Edward Thornton and Alonzo Jackman.|In the 1840s and 1850s several individuals proposed or advocated construction of a telegraph cable across the Atlantic Ocean, including Edward Thornton and Alonzo Jackman.
At that time there was no material available for cable insulation and the first breakthrough came with the discovery of a rubber-like latex called gutta percha.|At that time there was no material available for cable insulation and the first breakthrough came with the discovery of a rubber-like latex called gutta percha.
Introduced to Britain in 1843, gutta percha is the gum of a tree native to the Malay Peninsula and Malaysia.|Introduced to Britain in 1843, gutta percha is the gum of a tree native to the Malay Peninsula and Malaysia.
After the failure of their first cable in 1850, the British brothers John and Jacob Brett laid a successful submarine cable from Dover to Calais in 1851.|After the failure of their first cable in 1850, the British brothers John and Jacob Brett laid a successful submarine cable from Dover to Calais in 1851.
This used two layers of gutta percha insulation and an armoured outer layer.|This used two layers of gutta percha insulation and an armoured outer layer.
With thin wire and thick insulation, it floated and had to be weighed down with lead pipe.|With thin wire and thick insulation, it floated and had to be weighed down with lead pipe.
In the case of first submarine-cable telegraphy, there was the limitation of knowledge of how its electrical properties were affected by water.|In the case of first submarine-cable telegraphy, there was the limitation of knowledge of how its electrical properties were affected by water.
The voltage which may be impressed on the cable was limited to a definite value.|The voltage which may be impressed on the cable was limited to a definite value.
Moreover, for certain reasons, the cable have an impedance associated with it at the sending end which could make the voltage on the cable differ from the voltage applied to the sending-end apparatus.|Moreover, for certain reasons, the cable had an impedance associated with it at the sending end which could make the voltage on the cable differ from the voltage applied to the sending-end apparatus.
In fact, the cable be too big for a single boat, so two had to start in the middle of the Atlantic, join their cables and sail in opposite directions.|In fact, the cable was too big for a single boat, so two had to start in the middle of the Atlantic, join their cables and sail in opposite directions.
Amazingly, the first official telegram to pass between two continents be a letter of congratulation from Queen Victoria of the United Kingdom to the President of the United States, James Buchanan, on August 16, 1 858.|Amazingly, the first official telegram to pass between two continents was a letter of congratulation from Queen Victoria of the United Kingdom to the President of the United States, James Buchanan, on August 16, 1 858.
However, signal quality declined rapidly, slowing transmission to an almost unusable speed and the cable was destroyed the following month.|However, signal quality declined rapidly, slowing transmission to an almost unusable speed and the cable was destroyed the following month.
To complete the link between England and Australia, John Pender formed the British- Australian Telegraph Company.|To complete the link between England and Australia, John Pender formed the British- Australian Telegraph Company.
The first stage was to lay a 557nm cable from Singapore to Batavia on the island of Java in 1870.|The first stage was to lay a 557nm cable from Singapore to Batavia on the island of Java in 1870.
It seemed likely that it would come ashore qt the northern port of Darwin from where it might connect around the coast to Queensland and New South Wales.|It seemed likely that it would come ashore qt the northern port of Darwin from where it might connect around the coast to Queensland and New South Wales.
It was an undertaking more ambitious than spanning ocean.|It was an undertaking more ambitious than spanning ocean.
Flocks of sheep had to be driven with the 400 workers to provide food.|Flocks of sheep had to be driven with the 400 workers to provide food.
They needed horses and bullock carts and, for the parched interior, camels.|They needed horses and bullock carts and, for the parched interior, camels.
In the north, tropical rains left the teams flooded.|In the north, tropical rains left the teams flooded.
In the centre, it seemed that they would die of thirst.|In the centre, it seemed that they would die of thirst.
One critical section in the red heart of Australia involved finding a route through the McDonnell mountain range and then finding water on the other side.|One critical section in the red heart of Australia involved finding a route through the McDonnell mountain range and then finding water on the other side.
The water was not only essential for the construction teams.|The water was not only essential for the construction teams.
There had to be telegraph repeater stations every few hundred miles to boost the signal and the staff obviously had to have a supply of water.|There had to be telegraph repeater stations every few hundred miles to boost the signal and the staff obviously had to have a supply of water.
On August 22, 1872, the Northern and Southern sections of the Overland Telegraph Line be connected, uniting the Australian continent and within a few months, Australia was at last in direct contact with England via the submarine cable, too.|On August 22, 1872, the Northern and Southern sections of the Overland Telegraph Line were connected, uniting the Australian continent and within a few months, Australia was at last in direct contact with England via the submarine cable, too.
This allowed the Australian Government to receive news from around the world almost instantaneously for the first time.|This allowed the Australian Government to receive news from around the world almost instantaneously for the first time.
It could cost several pounds to send a message and it might take several hours for it to reach its destination on the other side of the globe, but the world would never be the same again.|It could cost several pounds to send a message and it might take several hours for it to reach its destination on the other side of the globe, but the world would never be the same again.
The telegraph was the first form of communication over a great distance and was a landmark in human history.|The telegraph was the first form of communication over a great distance and was a landmark in human history.
