Wrong|Correct;;
There are many more discoveries to be made on the route, including the windswept shore by Reykjanes lighthouse and kleifarvatn lake (home, according to legend, to a wormlike monster the size of a whale), and there’s a myriad of hiking trails.|There are many more discoveries to be made on the route, including the windswept shore by Reykjanes lighthouse and Kleifarvatn lake (home, according to legend, to a wormlike monster the size of a whale), and there’s a myriad of hiking trails.
You can do a round trip in less than a day, but it’s worth staying for a few days to fully explore the region.|You can do a round trip in less than a day, but it’s worth staying for a few days to fully explore the region.
For a different take on the golden circle – iceland’s most popular day tour – try nesjavallaleið (road 435) which is open in the summer.|For a different take on the Golden Circle – Iceland’s most popular day tour – try Nesjavallaleið (Road 435) which is open in the summer.
It slings through moss-covered lava landscapes and up and down steep hills, with a breathtaking view of þingvallavatn lake in the distance.|It slings through moss-covered lava landscapes and up and down steep hills, with a breathtaking view of Þingvallavatn lake in the distance.
Along the road are quite a few marked hiking trails, beckoning roadtrippers to temporarily ditch the car and get up-close-and-personal with the stunning landscape.|Along the road are quite a few marked hiking trails, beckoning roadtrippers to temporarily ditch the car and get up-close-and-personal with the stunning landscape.
puffs of steam are the telltale sign that you’re approaching nesjavallavirkjum power plant and the exclusive ion adventure hotel.|Puffs of steam are the telltale sign that you’re approaching Nesjavallavirkjum Power Plant and the exclusive ION Adventure Hotel.
The road continues along placid lakes, including Úlfljótsvatn with a lonely church on its banks.|The road continues along placid lakes, including Úlfljótsvatn with a lonely church on its banks.
You drive through a summer house region – where city dwellers go for weekend breaks – and then onto the main road past the perfectly-circular kerið crater lake, one of the obligatory golden circle stops.|You drive through a summer house region – where city dwellers go for weekend breaks – and then onto the main road past the perfectly-circular Kerið crater lake, one of the obligatory Golden Circle stops.
After gawking at gullfoss waterfall and spying geysir (from which all other geysers take their name!|After gawking at Gullfoss waterfall and spying Geysir (from which all other geysers take their name!
), you can drive back via þingvellir national park with a quick visit to the curious caves houses of laugarvatnshellar.|), you can drive back via Þingvellir National Park with a quick visit to the curious caves houses of Laugarvatnshellar.
Bookworms should also consider making a stop at gljúfrasteinn museum in mosfellsdalur.|Bookworms should also consider making a stop at Gljúfrasteinn museum in Mosfellsdalur.
The museum is the former home of prominent icelandic writer halldór laxness, who won the nobel prize in literature in 1955.|The museum is the former home of prominent Icelandic writer Halldór Laxness, who won the Nobel Prize in Literature in 1955.
set up camp in egilsstaðir and you’ll be in prime position to uncover the magical east fjords.|Set up camp in Egilsstaðir and you’ll be in prime position to uncover the magical East Fjords.
First, visit the village of vopnafjörður, home to selárlaug, a swimming pool on the banks of a salmon-filled river, which is also popular for fishing.|First, visit the village of Vopnafjörður, home to Selárlaug, a swimming pool on the banks of a salmon-filled river, which is also popular for fishing.
In summer, you could cross the spectacular mountain pass hellisheiði eystri (road 917) to get here – but with its narrow and steep gravel road, it’s not for the faint hearted.|In summer, you could cross the spectacular mountain pass Hellisheiði eystri (Road 917) to get here – but with its narrow and steep gravel road, it’s not for the faint hearted.
Regardless, take the easy way back (road 85 and road 1) to borgarfjörður eystri, and recharge at the village of bakkagerði with a hotel and spa, puffing watching house and popular music festival bræðslan, held in july.|Regardless, take the easy way back (Road 85 and Road 1) to Borgarfjörður eystri, and recharge at the village of Bakkagerði with a hotel and spa, puffing watching house and popular music festival Bræðslan, held in July.
It’s also a good base for hiking in the stunning surroundings, with the trek to stórurð, a turquoise lake enclaved by massive boulders, a particularly popular route.|It’s also a good base for hiking in the stunning surroundings, with the trek to Stórurð, a turquoise lake enclaved by massive boulders, a particularly popular route.
You must return to egilsstaðir before moving on to the next fjords on the route: eskifjörður and neskaupstaður.|You must return to Egilsstaðir before moving on to the next fjords on the route: Eskifjörður and Neskaupstaður.
Here, the maritime heritage of this region is honored in elegantly renovated historic houses: randulfssjóhús in eskifjörður and beituskúrinn in neskaupstaður; both of which now function as excellent, atmospheric restaurants.|Here, the maritime heritage of this region is honored in elegantly renovated historic houses: Randulfssjóhús in Eskifjörður and Beituskúrinn in Neskaupstaður; both of which now function as excellent, atmospheric restaurants.
drive back through fáskrúðsfjörður to stöðvarfjörður, where petra’s stone collection museum amazes, showcasing the sheer variety of minerals that can be found in the mountains in the country’s east.|Drive back through Fáskrúðsfjörður to Stöðvarfjörður, where Petra’s Stone Collection museum amazes, showcasing the sheer variety of minerals that can be found in the mountains in the country’s east.
From here, it’s a straight run back to egilsstaðir for the last time – remember to watch out for reindeer!|From here, it’s a straight run back to Egilsstaðir for the last time – remember to watch out for reindeer!
On the way to the westfjord from reykjavík, you’ll drive through the rural region of dalir.|On the way to the Westfjord from Reykjavík, you’ll drive through the rural region of Dalir.
Here, dairy farm erpsstaðir makes for a great first pitstop on the journey, where you can learn about traditional farming life and sample the homemade cheeses and other treats.|Here, dairy farm Erpsstaðir makes for a great first pitstop on the journey, where you can learn about traditional farming life and sample the homemade cheeses and other treats.
There are also a number of historical sites nearby, including eiríksstaðir, a living museum about life in the viking era, and guðrúnarlaug, the replica of the pool where the beautiful heroine of laxdæla saga (one of the famous medieval icelandic sagas) used to bathe.|There are also a number of historical sites nearby, including Eiríksstaðir, a living museum about life in the Viking era, and Guðrúnarlaug, the replica of the pool where the beautiful heroine of Laxdæla saga (one of the famous medieval Icelandic sagas) used to bathe.
Leaving dalir in the rearview mirror, the first Westfjordian town you’ll reach is reykhólar, home to sjávarböðin, a spa specialising in seaweed baths (said to have all manner of healing properties).|Leaving Dalir in the rearview mirror, the first Westfjordian town you’ll reach is Reykhólar, home to Sjávarböðin, a spa specialising in seaweed baths (said to have all manner of healing properties).
From here, the drive along the peninsula’s southern coast on steep gravel roads is both awe-inspiring and borderline scary, but your reward is a stroll on red-sand beach rauðasandur and the view from látrabjarg, iceland’s westernmost point.|From here, the drive along the peninsula’s southern coast on steep gravel roads is both awe-inspiring and borderline scary, but your reward is a stroll on red-sand beach Rauðasandur and the view from Látrabjarg, Iceland’s westernmost point.
látrabjarg is also a haven for birdlife, with thousands of seabirds, including puffins, razorbills and guillemots, nesting in the cliffs.|Látrabjarg is also a haven for birdlife, with thousands of seabirds, including puffins, razorbills and guillemots, nesting in the cliffs.
You can take the ferry from brjánslækur back, via flatey, an idyllic island which seems to be frozen in time.|You can take the ferry from Brjánslækur back, via Flatey, an idyllic island which seems to be frozen in time.
It used to be the bustling center of the breiðafjörður islands, but today, only seven people live there year-round.|It used to be the bustling center of the Breiðafjörður islands, but today, only seven people live there year-round.
From here, the ferry takes you onwards to stykkishólmur on snæfellsnes, entering via a beautiful harbour overlooked by a distant lighthouse.|From here, the ferry takes you onwards to Stykkishólmur on Snæfellsnes, entering via a beautiful harbour overlooked by a distant lighthouse.
It’s a view that might tempt you to stay a while; if you do, make sure to check out the Library of water, a modern art museum, and sample the locally-sourced seafood on offer at sjávarpakkhúsið.|It’s a view that might tempt you to stay a while; if you do, make sure to check out the Library of Water, a modern art museum, and sample the locally-sourced seafood on offer at Sjávarpakkhúsið.
In clear weather you can see the alluring ice cap snæfellsjökull from reykjavík.|In clear weather you can see the alluring ice cap Snæfellsjökull from Reykjavík.
The drive there is an adventure with ever-changing landscapes.|The drive there is an adventure with ever-changing landscapes.
You’ll find sand and pebble beaches, volcanoes, a glacier and rhyolite mountains, lava fields and grassy terrain, caves, bird-filled cliffs and waterfalls.|You’ll find sand and pebble beaches, volcanoes, a glacier and rhyolite mountains, lava fields and grassy terrain, caves, bird-filled cliffs and waterfalls.
The peninsula’s southern side is graced by white-sand beach löngufjörur, a hotspot for horseback riding, the otherworldly lava landscape around búðir and the many wonders of snæfellsjökull national park.|The peninsula’s southern side is graced by white-sand beach Löngufjörur, a hotspot for horseback riding, the otherworldly lava landscape around Búðir and the many wonders of Snæfellsjökull National Park.
On the northern side there are charming fishing villages and kirkjufell, one of iceland’s most photographed mountains – particularly popular when the northern lights are out.|On the northern side there are charming fishing villages and Kirkjufell, one of Iceland’s most photographed mountains – particularly popular when the northern lights are out.
Although it’s possible to do a whirlwind tour of snæfellsnes in a day, you can easily spend a few: hiking, bird watching, sailing or simply taking in the views of the immense glacier.|Although it’s possible to do a whirlwind tour of Snæfellsnes in a day, you can easily spend a few: hiking, bird watching, sailing or simply taking in the views of the immense glacier.
spice up your ring road (route 1) adventure by cutting through the barren interior of the country.|Spice up your Ring Road (Route 1) adventure by cutting through the barren interior of the country.
Road 35, which splinters off from Route 1 past gullfoss waterfall, continues along the ancient kjölur route between glaciers langjökull and hofsjökull.|Road 35, which splinters off from Route 1 past Gullfoss waterfall, continues along the ancient Kjölur route between glaciers Langjökull and Hofsjökull.
It’s an f-road, so it requires a 4x4 vehicle and is only open in the summer, but it is not as difficult as some of the other highland routes (for example, there are no river crossings.)|It’s an F-road, so it requires a 4x4 vehicle and is only open in the summer, but it is not as difficult as some of the other highland routes (for example, there are no river crossings.)
Around the halfway point is hveravellir, an oasis of sorts in the snowy desert landscape, with a lodge, natural pool for bathing and a multicolor geothermal area with marked hiking trails, including to kerlingarfjöll mountains.|Around the halfway point is Hveravellir, an oasis of sorts in the snowy desert landscape, with a lodge, natural pool for bathing and a multicolor geothermal area with marked hiking trails, including to Kerlingarfjöll mountains.
You enter the Ring road again about an hour’s drive from akureyri, the “capital” of the north, which is great for catching up on some culture, visiting galleries or having a night on the town (with at least three bars to choose from!)|You enter the Ring Road again about an hour’s drive from Akureyri, the “capital” of the north, which is great for catching up on some culture, visiting galleries or having a night on the town (with at least three bars to choose from!)
The ring road will take you from fjord to fjord, past eerie mountains and into quiet seaside villages.|The Ring Road will take you from fjord to fjord, past eerie mountains and into quiet seaside villages.
fáskrúðsfjörður is known for a museum which honors the legacy French sailors, located inside the beautifully renovated French hospital.|Fáskrúðsfjörður is known for a museum which honors the legacy French sailors, located inside the beautifully renovated French hospital.
In breiðdalsvík drop by microbrewery beljandi (named after a waterfall by the same name) and in djúpivogur take a look at the granite egg sculptures in gleðivík by renowned artist sigurður guðmundsson.|In Breiðdalsvík drop by microbrewery Beljandi (named after a waterfall by the same name) and in Djúpivogur take a look at the granite egg sculptures in Gleðivík by renowned artist Sigurður Guðmundsson.
north iceland’s answer to the golden circle is the diamond circle.|North Iceland’s answer to the Golden Circle is the Diamond Circle.
make your base in the whale watching town of húsavík and head east to ásbyrgi at the northern realms of vatnajökull national park.|Make your base in the whale watching town of Húsavík and head east to Ásbyrgi at the northern realms of Vatnajökull National Park.
The horseshoe shaped canyon is characterized by vertical cliffs – walk to the top of eyjan for an amazing view of the sand beaches to the north and the north atlantic.|The horseshoe shaped canyon is characterized by vertical cliffs – walk to the top of Eyjan for an amazing view of the sand beaches to the north and the North Atlantic.
This is gyrfalcon territory, the largest falcon in the world, so keep an eye out for the majestic raptors.|This is gyrfalcon territory, the largest falcon in the world, so keep an eye out for the majestic raptors.
With its lovely lake, lava fields, steaming fumaroles and bubbling hot springs, the mývatn area is an obligatory stop on the drive back to húsavík.|With its lovely lake, lava fields, steaming fumaroles and bubbling hot springs, the Mývatn area is an obligatory stop on the drive back to Húsavík.
Take time to marvel at the mighty goðafoss waterfall in skjálfandafljót.|Take time to marvel at the mighty Goðafoss waterfall in Skjálfandafljót.
It’s called “waterfall of the gods” because legend has it that the lawspeaker (a role in ancient Scandinavian society where someone is entrusted to recite the law) Þorgeir ljósvetningagoði threw his pagan sculptures in the falls after deciding that icelanders should convert to christianity in 1000AD.|It’s called “waterfall of the gods” because legend has it that the lawspeaker (a role in ancient Scandinavian society where someone is entrusted to recite the law) Þorgeir Ljósvetningagoði threw his pagan sculptures in the falls after deciding that Icelanders should convert to Christianity in 1000AD.
Further upstream is aldeyjarfoss, another spectacular waterfall surrounded by columnar basalt.|Further upstream is Aldeyjarfoss, another spectacular waterfall surrounded by columnar basalt.
don’t forget to reserve some time for húsavík itself, a bustling town with interesting museums and fabulous seafood restaurants.|Don’t forget to reserve some time for Húsavík itself, a bustling town with interesting museums and fabulous seafood restaurants.
geosea geothermal sea baths are perched up on húsavíurhöfði next to a yellow lighthouse with an unobstructed view of the whale watching boats on skjálfandi bay.|Geosea Geothermal Sea Baths are perched up on Húsavíurhöfði next to a yellow lighthouse with an unobstructed view of the whale watching boats on Skjálfandi bay.
Designed for slow travel, the arctic coast way slings along iceland’s northern coastline, encompassing sleepy villages, six islands and amazing natural sites few people get to see.|Designed for slow travel, the Arctic Coast Way slings along Iceland’s northern coastline, encompassing sleepy villages, six islands and amazing natural sites few people get to see.
The route starts at the seal-watching town hvammstangi in northwest iceland and ends in windblown bakkafjörður in the northeast.|The route starts at the seal-watching town Hvammstangi in Northwest Iceland and ends in windblown Bakkafjörður in the northeast.
On route, drivers will encounter dramatic views, lonely lighthouses, and some interesting stories.|On route, drivers will encounter dramatic views, lonely lighthouses, and some interesting stories.
At þrístapar, you can learn about the gruesome fate of agnes magnúsdóttir, the heroine of hannah kent’s burial rites who was the last woman executed in iceland.|At Þrístapar, you can learn about the gruesome fate of Agnes Magnúsdóttir, the heroine of Hannah Kent’s Burial Rites who was the last woman executed in Iceland.
At brimslóð in blönduós, there’s the option to go foraging for your dinner, and in skagaströnd have your fortune told at the museum of þórdís the prophetess.|At Brimslóð in Blönduós, there’s the option to go foraging for your dinner, and in Skagaströnd have your fortune told at the museum of Þórdís the Prophetess.
In summer, the midnight sun bounces off the ocean surface, and in winter, the northern lights dance across the night sky in between blinking stars – far from light pollution.|In summer, the midnight sun bounces off the ocean surface, and in winter, the northern lights dance across the night sky in between blinking stars – far from light pollution.
Other interesting stops include hvítserkur sea stack, the massive arctic henge in raufarhöfn, an ancient stone monument inspired by norse mythology, and the gannet colony at stóri karl on langanes.|Other interesting stops include Hvítserkur sea stack, the massive Arctic Henge in Raufarhöfn, an ancient stone monument inspired by Norse mythology, and the gannet colony at Stóri Karl on Langanes.
Take your time to explore on foot, or book whale watching, kayaking or diving tours for a different perspective of this wild coastal region.|Take your time to explore on foot, or book whale watching, kayaking or diving tours for a different perspective of this wild coastal region.
Ironically, niel now works in a bookshop, although he largely sticks to the non-fiction aisles.|Ironically, Niel now works in a bookshop, although he largely sticks to the non-fiction aisles.
His condition begs the question what is going on inside his picture-less mind.|His condition begs the question what is going on inside his picture-less mind.
I asked him what happens when he tries to picture his fiancee.|I asked him what happens when he tries to picture his fiancee.
"This is the hardest thing to describe, what happens in my head when I think about things," he says.|"This is the hardest thing to describe, what happens in my head when I think about things," he says.
"When I think about my fiancee there is no image, but I am definitely thinking about her, I know today she has her hair up at the back, she's brunette.|"When I think about my fiancee there is no image, but I am definitely thinking about her, I know today she has her hair up at the back, she's brunette.
But I'm not describing an image I am looking at, I'm remembering features about her, that's the strangest thing and maybe that is a source of some regret."|But I'm not describing an image I am looking at, I'm remembering features about her, that's the strangest thing and maybe that is a source of some regret."
The response from his mates is a very sympathetic: "You're weird."|The response from his mates is a very sympathetic: "You're weird."
But while niel is very relaxed about his inability to picture things, it is often a cause of distress for others.|But while Niel is very relaxed about his inability to picture things, it is often a cause of distress for others.
One person who took part in a study into aphantasia said he had started to feel "isolated" and "alone" after discovering that other people could see images in their heads.|One person who took part in a study into aphantasia said he had started to feel "isolated" and "alone" after discovering that other people could see images in their heads.
Being unable to reminisce about his mother years after her death led to him being "extremely distraught".|Being unable to reminisce about his mother years after her death led to him being "extremely distraught".
At the other end of the spectrum is children's book illustrator, lauren beard, whose work on the fairytale hairdresser series will be familiar to many six-year-olds.|At the other end of the spectrum is children's book illustrator, Lauren Beard, whose work on the Fairytale Hairdresser series will be familiar to many six-year-olds.
Her career relies on the vivid images that leap into her mind's eye when she reads text from her author.|Her career relies on the vivid images that leap into her mind's eye when she reads text from her author.
When I met her in her box-room studio in manchester, she was working on a dramatic scene in the next book.|When I met her in her box-room studio in Manchester, she was working on a dramatic scene in the next book.
The text describes a baby perilously climbing onto a chandelier.|The text describes a baby perilously climbing onto a chandelier.
"straightaway I can visualise this grand glass chandelier in some sort of French kind of ballroom, and the little baby just swinging off it and really heavy thick curtains," she says.|"Straightaway I can visualise this grand glass chandelier in some sort of French kind of ballroom, and the little baby just swinging off it and really heavy thick curtains," she says.
"I think I have a strong imagination, so I can create the world and then keep adding to it so it gets sort of bigger and bigger in my mind and the characters too they sort of evolve.|"I think I have a strong imagination, so I can create the world and then keep adding to it so it gets sort of bigger and bigger in my mind and the characters too they sort of evolve.
I couldn't really imagine what it's like to not imagine, I think it must be a bit of a shame really."|I couldn't really imagine what it's like to not imagine, I think it must be a bit of a shame really."
Not many people have mental imagery as vibrant as lauren or as blank as niel.|Not many people have mental imagery as vibrant as Lauren or as blank as Niel.
They are the two extremes of visualisation.|They are the two extremes of visualisation.
adam zeman, a professor of cognitive and behavioural neurology, wants to compare the lives and experiences of people with aphantasia and its polar-opposite hyperphantasia.|Adam Zeman, a professor of cognitive and behavioural neurology, wants to compare the lives and experiences of people with aphantasia and its polar-opposite hyperphantasia.
His team, based at the university of exeter, coined the term aphantasia this year in a study in the journal cortex.|His team, based at the University of Exeter, coined the term aphantasia this year in a study in the journal Cortex.
prof zeman tells the bbc: "People who have contacted us say they are really delighted that this has been recognised and has been given a name, because they have been trying to explain to people for years that there is this oddity that they find hard to convey to others."|Prof Zeman tells the BBC: "People who have contacted us say they are really delighted that this has been recognised and has been given a name, because they have been trying to explain to people for years that there is this oddity that they find hard to convey to others."
How we imagine is clearly very subjective - one person's vivid scene could be another's grainy picture.|How we imagine is clearly very subjective - one person's vivid scene could be another's grainy picture.
But prof zeman is certain that aphantasia is real.|But Prof Zeman is certain that aphantasia is real.
People often report being able to dream in pictures, and there have been reported cases of people losing the ability to think in images after a brain injury.|People often report being able to dream in pictures, and there have been reported cases of people losing the ability to think in images after a brain injury.
He is adamant that aphantasia is "not a disorder" and says it may affect up to one in 50 people.|He is adamant that aphantasia is "not a disorder" and says it may affect up to one in 50 people.
